A Chinese distributor of Sinovacs COVID vaccine says it is facing a shortage of drivers as the worst wave of,0.0
The Three Vaccines threegraces vaccine pfizer astrazeneca moderna covidfree raffaello,1.0
California state suspends batch of Moderna vaccine after a higher than expected allergic reaction Scripps Resear,0.0
Opinionby Zhong Yuan Lets examine some of the biggest fabrications during Chinas Jan press conference,0.0
Out of over million vaccination doses that have been administered globally equity COVID vaccine,0.0
LIVE Prof Glenda Gray is discussing the public personal academic and economic benefits of vaccinations Prof,0.0
The TurkishParliament will discuss the treaty on January Oppositon and UyghurActivists have raised concerns,0.0
Even if youve had your COVID vaccine its important that you continue to follow national restrictions We d,0.0
Resume covid vaccine publichealth,0.0
Vaccine,0.0
after our vaccine success thanks to Brexit compared to the disaster thats happening in the EU heres yet anothe,1.0
Resume covid vaccine publichealth,0.0
World Health Organisation states that second dose of vaccine must not be delayed propaganda and g,0.0
Even if youve had your COVID vaccine its important that you continue to follow national restrictions We d,0.0
Opinionby Zhong Yuan Lets examine some of the biggest fabrications during Chinas Jan press conference,0.0
How will your expatriates get vaccinated against COVID Vaccine COVID HR GlobalMobility,0.0
NEW You might have heard stories of covid vaccine shots being thrown out at the end of the day We wondered how,0.0
Brand new on the KeepSafe website today Covid Vaccine Interactive FAQ EasyRead AccessibleInformation,1.0
Even if youve had your COVID vaccine its important that you continue to follow national restrictions We d,0.0
Even if youve had your COVID vaccine its important that you continue to follow national restrictions We d,0.0
Pfizer pushes for tax breaks in federal budget cdnpoli vaccine,1.0
India is gifting made in India vaccine to Indian ocean countriesMaldives Mauritius Seyshelles a total of doses,0.0
